<?xml version="1.0" encoding="UTF-8"?>
<xsd:schema xmlns:xsd="http://www.w3.org/2001/XMLSchema" targetNamespace="http://www.phinc.by/pmc/project" 
		xmlns:pr="http://www.phinc.by/pmc/project">
	
	<xsd:element name="projects">
		<xsd:complexType>
			<xsd:sequence>
				<xsd:element name="project" type="pr:ProjectType" maxOccurs="unbounded"/>
			</xsd:sequence>
		</xsd:complexType>
	</xsd:element>
	
	<xsd:complexType name="ProjectType">
		<xsd:all>
			<xsd:element name="name" type="xsd:string" />
			<xsd:element name="description" type="xsd:string"/>
			<xsd:element name="customer" type="xsd:string"/>
			<xsd:element name="planned-start-date" type="xsd:date"/>
			<xsd:element name="planned-duration" type="pr:PlannedDurationType"/>
			<xsd:element name="actual-start-date" type="pr:ActualDateType"/>
			<xsd:element name="actual-duration" type="pr:ActualDurationType"/>
		</xsd:all>
		<xsd:attribute name="id" type="xsd:positiveInteger" use="required"/>
		<xsd:attribute name="status-id" type="xsd:positiveInteger" use="required"/>
	</xsd:complexType>
	
	<xsd:simpleType name="ActualDateType">
		<xsd:union memberTypes="pr:EmptyType xsd:date"/>
	</xsd:simpleType>
	
	<xsd:simpleType name="PlannedDurationType">
		<xsd:union memberTypes="pr:EmptyType pr:DecimalType"/>
	</xsd:simpleType>
	
	<xsd:simpleType name="ActualDurationType">
		<xsd:union memberTypes="pr:EmptyType pr:ActualDecimalType"/>
	</xsd:simpleType>
	
	<xsd:simpleType name="EmptyType">
		<xsd:restriction base="xsd:string">
			<xsd:enumeration value=""/>
		</xsd:restriction>
	</xsd:simpleType>
	
	<xsd:simpleType name="DecimalType">
		<xsd:restriction base="xsd:decimal">
			<xsd:fractionDigits value="1"/>
			<xsd:minExclusive value="0"/>
		</xsd:restriction>
	</xsd:simpleType>
	
	<xsd:simpleType name="ActualDecimalType">
		<xsd:restriction base="xsd:decimal">
			<xsd:fractionDigits value="1"/>
			<xsd:minInclusive value="0"/>
		</xsd:restriction>
	</xsd:simpleType>
	
</xsd:schema>